plan_id,category,subcategory,details,hierarchy_level
970,Patients,Adopting leading evidence-based standards and practices for patient safety and quality while continuously maintaining the highest level of accreditation.,,2
970,Patients,Engaging patients and families to co-design the best possible care experience through the growth and empowerment of our Patient and Family Advisory Program.,,2
970,Patients,Providing a culturally safe healthcare experience for First Nations, Inuit and Metis people through the advancement of the Indigenous Health Service and the development of an Indigenous Health Strategy.,,2
970,Patients,Understanding our community's health and equity data to respond to diverse needs and ensure culturally safe care for all.,,2
970,People,Leveraging the talents of our diverse workforce to foster a culture of excellence, while creating opportunities for both career growth and recruitment.,,2
970,People,Supporting the psychological safety, well-being, and resilience of our people to promote a thriving work environment across TeamBCHS.,,2
970,People,Fostering a culture of recognition and joy that inspires employees by connecting them to the purpose of their work, while upholding the highest standards of professionalism, respect, and accountability.,,2
970,People,Inspiring a culture of inclusion and belonging by advancing our Diversity, Equity, Inclusion, and Belonging (DEI-B) roadmap, aligned with our Indigenous Health Strategy and the Ontario Health Equity, Inclusion, Diversity, and Anti-Racism framework.,,2
970,Partners,Strengthening and formalizing partnerships with other healthcare organizations, particularly primary care providers, to improve access to and continuity of care.,,2
970,Partners,Leading collaborations with community organizations to implement innovative solutions to provide the right care at the right place.,,2
970,Partners,Growing our partnerships with academic institutions to enhance our academic mission, providing students with opportunities to learn and develop their careers.,,2
970,Partners,Participating in research opportunities to improve patient care.,,2
970,Partners,Strengthening outreach and partnership with diverse community groups to enhance patient and TeamBCHS experiences to reflect the communities we serve.,,2
970,Progress,Reimagining our care facilities by advancing the redevelopment of the Brant Community Healthcare System.,,2
970,Progress,Ensuring effective care delivery within our current facilities while also completing infrastructure renewal projects.,,2
970,Progress,Implementing a Digital Health Strategy that integrates innovative technologies—including the implementation of a new Health Information System—to enhance patient and provider experiences while streamlining operations.,,2
970,Progress,Creating a multi-year financial plan that focuses on financial sustainability and exploring non-ministry and new revenue streams to enhance our fiscal health.,,2
970,Progress,Advancing environmental sustainability by reducing waste, optimizing energy use, and incorporating green practices into hospital operations.,,2
970,Progress,Implementing a Clinical Services Plan that addresses the evolving needs of the diverse communities we serve, incorporating new programs and services to enhance access to high-quality and equitable care.,,2
916,Empower Our People,Attract, retain, and recognize our people,,2
916,Empower Our People,Focus on an engaged, inclusive, safe and healthy workplace,,2
916,Empower Our People,Enable teams to deliver high quality care with tools and resources,,2
916,Get Even Better,Use timely, evidence and data-based analysis to support decision making and enhance equitable access to care,,2
916,Get Even Better,Advance digital health opportunities,,2
916,Get Even Better,Continue to build for the future of our facility,,2
916,Deliver Patient Centred Quality Care,Listen to patients and families to support what's most important to them,,2
916,Deliver Patient Centred Quality Care,Build a safe, quality driven, continuous improvement culture following best practice guidelines,,2
916,Deliver Patient Centred Quality Care,Ensure population health measures inform our approach to decisions,,2
916,Deliver Patient Centred Quality Care,Promote health equity, ensuring inclusion and diversity are respected and achieved,,2
916,Connect Through Partnerships,Lead and pursue meaningful partnerships that extend our capability to support seamless, equitable and timely access to care,,2
916,Connect Through Partnerships,Strengthen our academic partnerships,,2
916,Connect Through Partnerships,Grow opportunities for training and development,,2
916,Connect Through Partnerships,Use technology to enhance efficiency, safety and care,,2
972,Serve,Deliver high quality and safe care driven by data and evidence,,2
972,Serve,Grow specialized services in areas aligned with our unique capabilities and strengths,,2
972,Discover,Build and strengthen partnerships to expand as a hub for advanced training in mental health, addictions, and geriatric care,,2
972,Discover,Evaluate innovative models of care and disseminate insights to shape a better health system,,2
972,Lead,Provide leadership, expertise, and enabling functions to design and deliver innovative integrated care models with partners,,2
972,Lead,Support and advocate for one system and help build capacity for community- and primary care-based mental health, substance use health and geriatric services,,2
972,Inspire,Create continuous opportunities for workforce training, learning and growth,,2
972,Inspire,Cultivate an inclusive and empowering culture that prioritizes staff well-being,,2
973,Strategy 1: Excellent Quality Service,Deliver a cultural competency training program, to staff and referral partners and evaluate effectiveness,,2
973,Strategy 1: Excellent Quality Service,Measure and monitor patient satisfaction rates for WAHA programs and services on an annualized basis,,2
973,Strategy 1: Excellent Quality Service,Expand the geriatric speciality clinic model, for outreach to all communities within the James and Hudson Bay Region,,2
973,Strategy 1: Excellent Quality Service,Develop a strategy for the WAHA website to increase public access to information and data collection,,2
973,Strategy 2: Quality Infrastructure,Support the implementation of the stage 2 provincial capital planning process for the development of new regional facilities,,2
973,Strategy 2: Quality Infrastructure,Engage in an objective analysis of governance, management and medical staff structures, decision-making and communication processes at WAHA to identify recommendations for strengthening these systems,,2
973,Strategy 2: Quality Infrastructure,Optimize the Hospital Information System in order to support information and data collection systems; leverage off NE LHIN's IT initiatives,,2
973,Strategy 2: Quality Infrastructure,Develop a process to identify and eliminate accessibility barriers to ensure compliance with provincial legislation,,2
973,Strategy 2: Quality Infrastructure,Optimize geographic logistics in order to promote cost-saving initiatives,,2
973,Strategy 3: Safety First,Provide introductory and refresher training to staff on WAHA's incident management program,,2
973,Strategy 3: Safety First,Promote wellness and mental wellbeing through cultural and traditional activities,,2
973,Strategy 3: Safety First,Provide timely access to appropriate health care services and optimize patient flow,,2
973,Strategy 3: Safety First,Implement quality improvement projects for key areas of need throughout the health system,,2
973,Strategy 4: Build Organizational Capability & Capacity,Support the development and roll out of a comprehensive staff orientation program,,2
973,Strategy 4: Build Organizational Capability & Capacity,Support the roll out of a staff recognition program that is consistent among all WAHA sites,,2
973,Strategy 4: Build Organizational Capability & Capacity,Support the roll out of staff satisfaction surveys every two years to help benchmark performance,,2
973,Strategy 4: Build Organizational Capability & Capacity,Create and deliver a training program that supports the roll out of the new performance management system,,2
973,Strategy 4: Build Organizational Capability & Capacity,Work with department heads to establish a recruitment and retention strategy that is targeted towards physicians, nurses and skilled tradespeople,,2
973,Strategy 5: Financial Health,Optimize financial, physical infrastructure, and human resources through implementation of the hospital improvement plan,,2
973,Strategy 5: Financial Health,Take advantage of funding opportunities by applying to funding programs and non-government sources,,2
973,Strategy 5: Financial Health,Assess our progress and improve value through standardized performance measures,,2
973,Strategy 5: Financial Health,Identify opportunities for cost control that support productivity improvements and financial accountability,,2
973,Strategy 5: Financial Health,Implement a comprehensive fundraising strategy for WAHA that increases our donations,,2
905,PEOPLE,We will become a health system of choice to work, practice, volunteer, and learn…,by enhancing our approach to focused retention, prioritizing wellbeing, and strengthening our investment in our people.,2
905,PEOPLE,We will become a health system of choice to work, practice, volunteer, and learn…,by employing purposeful recruitment to address our programs and community priorities.,2
905,PEOPLE,We will foster a people-centred culture of belonging…,by creating and empowering high-performing teams that advance collaborative health care.,2
905,PEOPLE,We will foster a people-centred culture of belonging…,by improving the understanding of our lived experience through radical engagement and creating safe spaces to listen and incorporate ideas to advance equity, diversity, inclusion, and belonging.,2
905,CONNECTIONS,We will become a magnet for partnership…,by prioritizing collaboration over competition and demonstrating the benefits of partnering with us.,2
905,CONNECTIONS,We will foster connectivity with our community…,by enhancing community engagement and reach, and employing co-design and co-delivery models wherever possible.,2
905,CONNECTIONS,We will actively participate in system design…,by strengthening relationships and alliances with primary care, community providers, our Eastern York Region North Durham Ontario Health Team, and system partners to create seamless transitions and address the needs of all our patients including underserved populations.,2
905,GROWTH,We will accelerate our academic endeavours…,by enhancing our academic affiliations, creating an extraordinary learner experience for trainees and staff, and expanding our research program.,2
905,GROWTH,We will drive progress through innovation…,by leading the field in responding with agility to the ever-changing health care environment, and empowering our teams to explore new ways of doing things.,2
905,GROWTH,We will drive progress through innovation…,by automating legacy processes, evolving technology, and enhancing data-driven decision-making.,2
905,GROWTH,We will address the needs of the patients and communities we serve through targeted growth…,by methodically expanding our physical space and purposefully expanding our programs and services to meet the needs of the patients and communities we serve, while mindful of the impact to the environment.,2
976,Enhance excellence and integration in care and service,Advance quality and leading practices in all parts of the organization, equipping our people to translate evidence into practice.,,2
976,Enhance excellence and integration in care and service,Engage with partners to support the health and well-being of our patients and their essential care partners.,,2
976,Enhance excellence and integration in care and service,Lead in integrated care pathways that are simple to navigate and are interconnected across our sites and with our partners.,,2
976,Enhance excellence and integration in care and service,Enable delivery of care beyond our walls, through virtual care, system navigation and creation of new pathways with system partners.,,2
976,Enhance excellence and integration in care and service,Partner with patients and their essential care partners to provide inclusive, compassionate Person-Centred Care.,,2
976,Enhance excellence and integration in care and service,Advance patient safety, quality, excellence and workforce well-being through investments in technology and innovation.,,2
976,Build a caring and inclusive culture and environment,Advance our culture of belonging, where everyone feels safe and is able to contribute and grow.,,2
976,Build a caring and inclusive culture and environment,Design all of our care environments in partnership with our patients, our people and their essential care partners.,,2
976,Build a caring and inclusive culture and environment,Create and maintain environments that are sustainable and promote collaboration, healing, well-being and learning.,,2
976,Build a caring and inclusive culture and environment,Prioritize and equip our teams with the tools, knowledge and scope of work that enable wellness and excellence in care.,,2
976,Build a caring and inclusive culture and environment,Expand and enhance home and community services and create a campus of care.,,2
976,Optimize care and performance,Enable our people by building capacity for quality and operational performance excellence at all levels of the organization.,,2
976,Optimize care and performance,Optimize operational processes and performance to improve service delivery and patient flow, maximize funding and reduce the cost of service.,,2
976,Optimize care and performance,Maximize the use of resources to sustain long-term financial health to enable the transformation of care.,,2
976,Optimize care and performance,Grow targeted areas of specialization in line with provincial priorities.,,2
976,Optimize care and performance,Develop long-term sustainability of our work force through anticipation of required human capital and innovative care delivery models.,,2
976,Advance discovery, education and the science of care,Prioritize discovery research and further the science of care.,,2
976,Advance discovery, education and the science of care,Promote synergies between discovery research, knowledge translation, teaching and clinical practice.,,2
976,Advance discovery, education and the science of care,Be a teaching and learning environment of choice.,,2
976,Advance discovery, education and the science of care,Be a magnet for top clinicians, researchers, learners, employees and volunteers.,,2
976,Advance discovery, education and the science of care,Create an environment where our people are inspired and equipped to flourish in the discovery, innovation and dissemination of knowledge.,,2
976,Advance discovery, education and the science of care,Evaluate the impact and outcomes of our discovery and innovation efforts and the application to care.,,2
976,Advance discovery, education and the science of care,Inspire philanthropy to support our academic and clinical priorities.,,2
971,Care with Purpose and Compassion,Embrace our Mission by championing compassionate care and service for all.,,2
971,Care with Purpose and Compassion,Enhance and broaden our Equity, Diversity, and Inclusion (EDI), Anti-Racism, and Indigenous reconciliation initiatives to cultivate a welcoming, respectful, and inclusive environment.,,2
971,Cultivate a Thriving Workforce,Become the leading workplace by prioritizing effective retention strategies and enhancing recruitment efforts.,,2
971,Cultivate a Thriving Workforce,Nurture a supportive atmosphere that ensures staff psychological health & safety, promotes well-being, and increases job satisfaction.,,2
971,Cultivate a Thriving Workforce,Embrace a distributed leadership approach and offer training, development, and mentorship programs for staff members.,,2
971,Advance our Excellence in Care,Enhance person-centred care and health outcomes by implementing new models of care.,,2
971,Advance our Excellence in Care,Identify gaps and unmet needs within our community and implement targeted solutions to support our most vulnerable populations.,,2
971,Amplify our Impact Across the Sector,Solidify our leadership role in care excellence and in championing the Catholic Mission in healthcare.,,2
971,Amplify our Impact Across the Sector,Share our transformative strategies, initiatives, and results to elevate care in the sector.,,2
974,Accountability to High Quality Care,,,,1
974,Wellbeing & Engagement,,,,1
974,Celebrating Community Partnerships,,,,1
974,Innovation & Digital Enablement,,,,1
974,Plan Execution & Implementation,,,,1
907,WE WILL IMPROVE THE EXPERIENCE OF OUR PATIENTS,WE WILL HELP LEAD THE IMPLEMENTATION OF THE ÉQUIPE SANTÉ ONTARIO COCHRANE DISTRICT ONTARIO HEALTH TEAM,,2
907,WE WILL IMPROVE THE EXPERIENCE OF OUR PATIENTS,WE WILL PLACE THE PATIENT VOICE AT THE CENTRE OF ALL PROGRAM DESIGN, DELIVERY AND REVIEW,,2
907,WE WILL IMPROVE THE EXPERIENCE OF OUR PATIENTS,WE WILL LEAD AND IMPLEMENT KEY PROJECTS AIMED AT IMPROVING PATIENT SAFETY, QUALITY OF CARE AND REDUCING SERVICE WAIT TIMES,,2
907,WE WILL IMPROVE THE EXPERIENCE AND WELLBEING OF OUR HEALTH PROVIDERS,WE WILL LEAD THE FACILITATION OF THE RETENTION & RECRUITMENT OF HEALTH HUMAN RESOURCE (HHR) FOR THE NORTH,,2
907,WE WILL IMPROVE THE EXPERIENCE AND WELLBEING OF OUR HEALTH PROVIDERS,WE WILL CREATE A CULTURE OF SUPPORT AND WELLNESS WITHIN OUR HOSPITAL AND ACROSS THE DISTRICT,,2
907,WE WILL IMPROVE THE EXPERIENCE AND WELLBEING OF OUR HEALTH PROVIDERS,WE WILL AMPLIFY THE VOICE OF OUR STAFF AND OUR PHYSICIANS,,2
907,WE WILL IMPROVE POPULATION HEALTH,WE WILL WORK COLLABORATIVELY WITH OUR PARTNERS TO DEVELOP AND IMPLEMENT INNOVATIVE WAYS TO IMPROVE HEALTH AND HEALTH SERVICE DELIVERY IN THE NORTH,,2
907,WE WILL IMPROVE POPULATION HEALTH,WE ARE GOING TO ENHANCE OUR ABILITY TO PROVIDE EQUITABLE, EVIDENCE-BASED AND QUALITY PATIENT CARE,,2
907,WE WILL IMPROVE POPULATION HEALTH,WE WILL TAKE A PROACTIVE APPROACH AND CONNECT WITH OUR COMMUNITY, DISTRICT AND LEADERSHIP TO PINPOINT THE MOST PREVALENT POPULATION HEALTH ISSUES,,2
907,WE WILL SUSTAIN THE FINANCIAL HEALTH OF OUR HOSPITAL,WE ARE GOING TO BE LEADERS IN DEFINING WHAT IT MEANS TO BE AN ONTARIO HEALTH TEAM IN THE COCHRANE DISTRICT,,2
907,WE WILL SUSTAIN THE FINANCIAL HEALTH OF OUR HOSPITAL,WE ARE GOING TO INVEST AND ADVOCATE FOR THE INVESTMENT OF PROVINCIAL HEALTH SPENDING IN THE NORTH,,2
907,WE WILL FOCUS ON EQUITY AND SOCIAL ACCOUNTABILITY,WE WILL ADVANCE SOCIAL ACCOUNTABILITY, BE LEADERS FOR CHANGE AND AMPLIFY THE VOICES OF THE MARGINALIZED IN OUR COMMUNITY,,2
907,WE WILL FOCUS ON EQUITY AND SOCIAL ACCOUNTABILITY,WE WILL EMBED EQUITY, DIVERSITY AND INCLUSION INTO ALL OF THE WORK WE DO AND PROVIDE OPPORTUNITIES FOR GROWTH AND LEARNING FOR OUR TEAMS AND PARTNERS,,2
928,Provide an excellent experience for the persons we serve, every time,Deploy best practice to deliver safest possible care,,2
928,Provide an excellent experience for the persons we serve, every time,Remove barriers to care,,2
928,Provide an excellent experience for the persons we serve, every time,Improve care transitions and health system navigation,,2
928,Meet the changing needs of our community,Improve our physical facilities and infrastructure,,2
928,Meet the changing needs of our community,Align our services with the needs of the community,,2
928,Meet the changing needs of our community,Improve engagement with our community and our partners,,2
928,Support and empower our people,Ensure a supportive and safe work environment,,2
928,Support and empower our people,Recruit and retain high-performing people,,2
928,Support and empower our people,Ensure our people have the right skills for now and the future,,2
928,Ensure our future sustainability,Secure the capital funds required to meet the needs of our community,,2
928,Ensure our future sustainability,Secure the operational funding required to meet the needs of our community,,2
928,Ensure our future sustainability,Ensure we are prepared to respond to a changing environment,,2